attributeID,attributeName,description,iconID,defaultValue,published,displayName,unitID,stackable,highIsGood,categoryID
2,None,Boolean to store status of online effect,None,0.0,0,None,None,1,1,9
3,Item Damage,current structure damage dealt to module,1386,0.0,1,Item Damage,113,1,0,7
4,Mass,Integer that describes the types mass,76,0.0,1,Mass,2,0,1,4
6,Activation Cost,The amount of charge used from the capacitor for a module activation.,1400,0.0,1,Activation Cost,114,1,0,5
8,None,tbd,1391,0.0,0,None,None,1,1,9
9,Structure Hitpoints,The maximum hitpoints of an object.,67,0.0,1,Structure Hitpoints,113,1,1,4
11,Powergrid Output,power output of power core,1400,0.0,1,Powergrid Output,107,1,1,1
12,Low Slots,The number of low power slots on the ship.,295,0.0,1,Low Slots,122,1,1,1
13,Medium Slots,tbd,294,0.0,1,Medium Slots,122,1,1,1
14,High Slots,tbd,293,0.0,1,High Slots,122,1,1,1
15,Power Load,Current load of power core,1400,0.0,1,Power Load,107,1,1,7
18,None,charge of module,1668,0.0,0,None,114,1,1,9
19,None,tbd,None,0.0,0,None,None,1,1,9
20,Maximum Velocity Bonus,Factor by which topspeed increases.,1389,1.0,1,Maximum Velocity Bonus,124,0,1,28
21,None,tbd instance param,None,0.0,0,None,None,1,1,17
29,None,tbd,None,0.0,0,None,None,1,1,9
30,Powergrid Usage,current power need,70,0.0,1,Powergrid Usage,107,1,0,1
31,None,The number of hit points this module can take  ,1383,0.0,0,None,None,1,1,9
32,None,The number of hit points when this module goes offline  ,None,0.0,0,None,None,1,1,9
37,Maximum Velocity,Maximum velocity of ship,1389,0.0,1,Maximum Velocity,11,0,1,17
38,Capacity,The cargo space allowed,71,0.0,1,Capacity,9,1,1,4
39,Damage Repaired Bonus,The damage this weapon deals,None,0.0,1,Damage Repaired Bonus,105,1,1,7
47,None,"The number of slots this module requires.  Only used for launchers, bays and turrets.",None,1.0,0,None,None,1,1,9
48,CPU Output,CPU output of ship,1405,0.0,1,CPU Output,106,1,1,1
49,CPU Load,CPU load of ship,1405,0.0,1,CPU Load,106,1,1,9
50,CPU usage,CPU need of module,1405,0.0,1,CPU usage,106,1,0,1
51,Rate of fire,Time in milliseconds between possible activations,1397,0.0,1,Rate of fire,101,0,0,29
52,None,Substracted before damage application.,None,0.0,0,None,None,1,1,9
54,Optimal Range,Distance below which range does not affect the to-hit equation.,1391,0.0,1,Optimal Range,1,0,1,29
55,Capacitor Recharge time,Amount of time taken to fully recharge the capacitor.,1392,0.0,1,Capacitor Recharge time,101,1,0,5
56,Charges Per Cycle,Number of charges consumed per activation,1397,1.0,1,Charges Per Cycle,None,1,1,7
61,None,GroupID of module targeted by this weapon,None,0.0,0,None,None,1,1,9
63,None,Something to do with accuracy.,1399,0.0,0,None,None,1,1,9
64,Damage Modifier,Damage multiplier.,1432,1.0,1,Damage Modifier,104,0,1,29
65,None,HP bonus to armor.,1383,0.0,0,None,None,1,1,9
66,Duration Bonus,Bonus to duration.,1392,0.0,1,Duration Bonus,105,1,1,7
67,Capacitor Bonus,Extra batteries to add capacitor.,1400,0.0,1,Capacitor Bonus,114,1,1,5
68,Shield Bonus,Bonus to shield.,1384,0.0,1,Shield Bonus,113,0,1,2
69,None,Bonus to rate/conversion ratio.,1397,0.0,0,None,None,1,1,9
70,Inertia Modifier,The agility of the object.,1401,0.0,1,Inertia Modifier,104,0,0,17
72,Shield Hitpoint Bonus,Bonus to capacity (shield at least).,69,0.0,1,Shield Hitpoint Bonus,113,1,1,2
73,Activation time / duration,Length of activation time.,1392,0.0,1,Activation time / duration,101,1,0,7
75,None,DO NOT MESS WITH. How many hp are in one capacity unit,None,1.0,0,None,None,1,1,9
76,Maximum Targeting Range,Maximum range at which the scanner can lock a target.,1391,0.0,1,Maximum Targeting Range,1,0,1,6
77,Mining amount,How much ore gets mined,22,0.0,1,Mining amount,9,1,1,51
79,None,scanning speed in milliseconds,74,0.0,0,None,101,0,0,6
80,Speed Bonus,Amount to increase the maximum speed by.,1389,0.0,1,Speed Bonus,11,1,1,7
81,None,Factor to modify the hp by.,None,0.0,0,None,None,1,1,9
82,None,Modifier for the maximum structural strength.,None,0.0,0,None,None,1,1,9
83,Structure Hitpoints Repaired,An amount to modify the structural damage by.,80,0.0,1,Structure Hitpoints Repaired,113,1,1,7
84,Armor Hitpoints Repaired,An amount to modify the armor damage by.,80,0.0,1,Armor Hitpoints Repaired,113,0,1,7
87,shield Transfer Range,Maximum range for use of a shield transfer.,1391,0.0,1,shield Transfer Range,1,1,1,2
88,None,Amount to drain from shield.,1384,0.0,0,None,None,1,1,9
89,None,Maximum range shield can be drained at.,None,0.0,0,None,None,1,1,9
90,Energy transfer amount,Amount of power to transfer.,1033,0.0,1,Energy transfer amount,120,1,1,22
91,Transfer range,Maximum range to transfer power from.,1391,0.0,1,Transfer range,1,1,1,7
92,None,The strength of the kinetic dampening field.  If high may nullify projectiles.,None,0.0,0,None,None,1,1,9
93,None,Amount to adjust a kinetic dampening field by.,None,0.0,0,None,None,1,1,9
95,None,The strength of the energy reflection field. If high may reflect energy at shooter.,None,0.0,0,None,None,1,1,9
96,None,Amount to adjust a energy reflection strength by.,None,0.0,0,None,None,1,1,9
97,Neutralization Amount,An amount to modify the power of the target by.,1400,0.0,1,Neutralization Amount,114,1,1,22
98,Neutralization Optimal Range,Optimal Range of Energy Neutralizer,1391,0.0,1,Neutralization Optimal Range,1,1,1,22
99,Area of effect radius,Range of broadcasted EMP field.,1391,0.0,1,Area of effect radius,1,1,1,7
101,Launcher Hardpoints,The number of remaining unused launcher slots.,168,0.0,1,Launcher Hardpoints,141,1,1,1
102,Turret Hardpoints,Remaining number of unused turret slots on the ship.,387,0.0,1,Turret Hardpoints,141,1,1,1
103,Warp Disruption Range,Maximum range objects can be warp scrambled from.,1391,0.0,1,Warp Disruption Range,1,1,1,27
104,Warp Scramble Status,Warp ability of a ship.  If greater than zero than the ship cannot warp.,None,0.0,1,Warp Scramble Status,None,1,1,7
105,Warp Scramble Strength,Amount to modify ships warp scramble status by.,111,0.0,1,Warp Scramble Strength,None,1,1,27
106,Drone Bay Hardpoints,The remaining amount of unused drone bay slots on the ship.,138,0.0,1,Drone Bay Hardpoints,None,1,1,10
107,None,Range in meters of explosion effect area.,1390,0.0,0,None,1,1,1,9
108,None,the range in meters for an object to trigger detonation of missile. (own ship excluded),None,0.0,0,None,1,1,1,9
109,Structure Kinetic Damage Resistance,damage multiplier vs. kinetic damagers.,1393,1.0,1,Structure Kinetic Damage Resistance,108,0,0,4
110,Structure Thermal Damage Resistance,damage multiplier vs. thermal.,1394,1.0,1,Structure Thermal Damage Resistance,108,0,0,4
111,Structure Explosive Damage Resistance,damage multiplier vs. explosive damagers.,1395,1.0,1,Structure Explosive Damage Resistance,108,0,0,4
112,None,Percentage of energy damage that is absorbed as available power.,1400,0.0,0,None,None,1,1,9
113,Structure EM Damage Resistance,"Electro magnetic damage multiplier for shield and armor. Represented as ""% Resistance"" in the UI.",1396,1.0,1,Structure EM Damage Resistance,108,0,0,4
114,EM damage,EM damage done.,1388,0.0,1,EM damage,113,1,1,29
116,Explosive damage,Explosive damage done.,1387,0.0,1,Explosive damage,113,1,1,29
117,Kinetic damage,Kinetic damage done.,1385,0.0,1,Kinetic damage,113,1,1,29
118,Thermal damage,Thermal damage done.,1386,0.0,1,Thermal damage,113,1,1,29
120,Range bonus,Multiplier of range the relevant weapon.,1391,1.0,1,Range bonus,109,1,1,7
121,Power Output Bonus,Bonus to output of power core.,1384,0.0,1,Power Output Bonus,107,1,1,7
122,None,Chance of piercing the armor.,1383,0.0,0,None,None,1,1,9
123,None,Chance of piercing the shield.,None,0.0,0,None,None,1,1,9
124,None,The main color of a ship type.,None,0.0,0,None,None,1,1,9
125,Ship scanning range,Maximum range that something can be ship scanned from.,1391,0.0,1,Ship scanning range,1,1,1,7
126,Cargoscan range,Maximum range the cargo of a ship can be scanned from.,1391,0.0,1,Cargoscan range,1,1,1,7
127,None,A temporary attribute for projectile/hybrid weapons to indicate which charges they have loaded when created in newbie ships ala ammo.,None,0.0,0,None,None,1,1,7
128,Charge size,The size of the charges that can fit in the turret/whatever.,1666,0.0,1,Charge size,117,1,1,7
129,None,Specifies the maximum numbers of passengers that the ship can have,413,0.0,0,None,None,1,1,9
130,Thermal Damage Resistance Bonus,Multipler to adjust the thermal damage resonance of an object.,1394,1.0,1,Thermal Damage Resistance Bonus,111,1,0,7
131,Kinetic Damage Resistance Bonus,Multiplier to the kinetic damage resonance of something.,1393,1.0,1,Kinetic Damage Resistance Bonus,111,1,0,7
132,Explosive Damage Resistance Bonus,Multiplier to the explosive damage resistance of something.,1395,1.0,1,Explosive Damage Resistance Bonus,111,1,0,7
133,EM Damage Resistance Bonus,Multiplier to the EM damage resonance of something.,1396,1.0,1,EM Damage Resistance Bonus,111,0,0,7
134,Shield recharge rate bonus,Multiplier to a recharge rate time.,1392,1.0,1,Shield recharge rate bonus,111,1,0,2
135,None,"The size of the module, 1 = small, 2 = medium, 3 = large.  Used for turrets and projectile weapons but will work for any module that defines it.",None,0.0,0,None,None,1,1,9
136,None,"This number is deducted from the %chance of the seeping to armor, to slow seep of damage through shield.",None,0.0,0,None,None,1,1,2
137,Used with (Launcher Group),One of the groups of launcher this charge can be loaded into.,1397,0.0,1,Used with (Launcher Group),115,1,1,7
138,EM Damage Bonus,+/- amount to the EM damage done.,1388,0.0,1,EM Damage Bonus,113,1,1,7
139,Explosive Damage Bonus,+/- amount to the explosive damage done.,1387,0.0,1,Explosive Damage Bonus,113,1,1,7
140,Kinetic Damage Bonus,+/- amount to the kinetic damage done.,1385,0.0,1,Kinetic Damage Bonus,113,1,1,7
141,Thermal Damage Bonus,+/- bonus to the thermal damage done.,1386,0.0,1,Thermal Damage Bonus,113,1,1,7
142,ECM Burst Radius,Range that an ECM burst has an effect within.,1390,0.0,1,ECM Burst Radius,1,1,1,7
143,Targeting range,Range of the automated targeting systems hostile targeting area.,1391,0.0,1,Targeting range,1,1,1,7
144,Capacitor recharge rate bonus,Multiplier to the capacitors recharge rate.,1400,1.0,1,Capacitor recharge rate bonus,111,1,0,5
145,Powergrid bonus,Multipier to power core output.,70,1.0,1,Powergrid bonus,109,1,1,7
146,Shield Hitpoint Bonus,Multiplier to the capacity of a shield.,1384,1.0,1,Shield Hitpoint Bonus,109,1,1,2
147,Capacitor Capacity Bonus,,1400,1.0,1,Capacitor Capacity Bonus,109,1,1,5
148,Armor Hitpoint Bonus,Multiplier to the HP of a ships armor module.,1383,1.0,1,Armor Hitpoint Bonus,109,1,1,3
149,Cargo capacity bonus,Multiplier to the amount of cargo capacity for a ship.,71,1.0,1,Cargo capacity bonus,109,1,1,4
150,Structure Hitpoint Bonus,Multiplier to the ships structural HP.,67,1.0,1,Structure Hitpoint Bonus,109,1,1,7
151,Inertia Modifier,Bonus to the agility for a ship.,1401,0.0,1,Inertia Modifier,105,1,1,7
152,Maximum Passengers Bonus,+/- a number to the max passengers.,None,0.0,1,Maximum Passengers Bonus,None,1,1,7
153,None,The power cost to warp per one kg per AU (floats do not have the resolution for meters).,None,0.0,0,None,None,1,1,17
154,Activation proximity,The distance at which to react when relevant objects come within range.,1390,0.0,1,Activation proximity,1,1,1,7
156,None,The hull damage proportion at which an entity becomes incapacitated.,None,0.0,0,None,None,1,1,9
157,None,The range at which this thing does it thing.,None,0.0,0,None,None,1,1,17
158,Accuracy falloff,distance from maximum range at which accuracy has fallen by half,1399,1.0,1,Accuracy falloff,1,0,1,29
160,Turret Tracking,Weapon accuracy,1398,0.0,1,Turret Tracking,None,0,1,29
161,Volume,Volume of things in cubic meters,67,0.0,1,Volume,9,1,1,4
162,None,Radius of an object in meters,1390,0.0,0,None,None,1,1,9
163,None,Where you want an effect to finish instantly.,None,0.0,0,None,None,1,1,9
164,Charisma,The charisma of a character.,1378,0.0,1,Charisma,120,1,1,7
165,Intelligence,The intelligence of a character.,1380,0.0,1,Intelligence,120,1,1,7
166,Memory,The memory of a character.,1381,0.0,1,Memory,120,1,1,7
167,Perception,The perception of a character.,1382,0.0,1,Perception,120,1,1,9
168,Willpower,The willpower of a character.,1379,0.0,1,Willpower,120,1,1,7
169,Inertia Modifier,Multiplier to the agility of an object.,1401,0.0,1,Inertia Modifier,121,1,1,7
170,None,Bonus to the charisma of a character specified by the player in character creation.,1378,0.0,0,None,None,1,1,9
171,None,Bonus to the willpower of a character specified by the player in character creation.,1379,0.0,0,None,None,1,1,9
172,None,Bonus to the perception of a character specified by the player in character creation.,1382,0.0,0,None,None,1,1,9
173,None,Bonus to the memory of a character specified by the player in character creation.,1381,0.0,0,None,None,1,1,9
174,None,Bonus to the intelligence of a character specified by the player in character creation.,1380,0.0,0,None,None,1,1,9
175,Charisma Modifier,+/- bonus to the charisma of a character.,1378,0.0,1,Charisma Modifier,120,1,1,7
176,Intelligence Modifier,+/- bonus to the intelligence of a character.,1380,0.0,1,Intelligence Modifier,120,1,1,7
177,Memory Modifier,+/- bonus to the memory of a character.,1381,0.0,1,Memory Modifier,120,1,1,7
178,Perception Modifier,+/- bonus to the perception of a character.,1382,0.0,1,Perception Modifier,120,1,1,7
179,Willpower Modifier,+/- bonus to the willpower of a character.,1379,0.0,1,Willpower Modifier,120,1,1,7
180,Primary attribute,Only refers to another dogma attribute.,None,0.0,1,Primary attribute,119,1,1,7
181,Secondary attribute,Only refers to another dogma attribute.,None,0.0,1,Secondary attribute,119,1,1,7
182,Primary Skill required,The type ID of the skill that is required.,33,0.0,1,Primary Skill required,116,1,1,8
183,Secondary Skill required,The type ID of the skill that is required.,33,0.0,1,Secondary Skill required,116,1,1,8
184,Tertiary Skill required,The type ID of the skill that is required.,33,0.0,1,Tertiary Skill required,116,1,1,8
185,None,The number of attribute points needed to be accrued to learn this skill.,None,0.0,0,None,None,1,1,9
186,None,Multiplier to the warping power cost.,None,0.0,0,None,None,1,1,17
187,None,Multiplier to adjust the cost of repairs.,None,1.0,0,None,None,1,1,9
188,Cargo Scan Resistance,Chance of being able to resist a cargo scan.,106,0.0,1,Cargo Scan Resistance,127,1,1,36
189,None,"On a targeted module, module can only be activated against a target from this type list.",None,0.0,0,None,None,1,1,None
190,None,The maximum number of members that a CEO can manage within their corporation.,None,0.0,0,None,None,1,1,9
191,corporation Member Bonus,+/- modifier to the number of members that a CEO can manage within their corporation.,None,0.0,1,corporation Member Bonus,139,1,1,7
192,Maximum Locked Targets,Maximum number of locked targets that the character or their ships electronics can handle at any given time.  Both have individual limits which apply separately.,109,0.0,1,Maximum Locked Targets,None,1,1,6
193,None,The maximum number of their targets that the character can attack at a given time.,None,0.0,0,None,None,1,1,6
194,None,The resistance to target jamming.,None,0.0,0,None,None,1,1,7
195,None,The race ID of the type.,None,0.0,0,None,None,1,1,31
196,None,The maximum amount of manufacture slots that can be used at a time.,None,0.0,0,None,None,1,1,9
197,Survey Scan Range,Distance from thing to survey.,None,0.0,1,Survey Scan Range,1,1,1,7
202,CPU Output bonus,Factor to adjust module cpu need by.,1405,1.0,1,CPU Output bonus,109,1,1,1
203,None,Factor to scale mining laser durations by.,None,0.0,0,None,None,1,1,51
204,Rate of Fire Bonus,"Typically scales the firing speed of a weapon.  Reducing speed means faster, strangely..",1389,1.0,1,Rate of Fire Bonus,111,1,0,7
205,None,Scales the accuracy of some targeted weapon.,1399,1.0,0,None,None,1,1,9
207,Mining Amount Multiplier,The factor by which the amount mined by a mining laser is scaled.,None,1.0,0,Mining Amount Multiplier,None,0,1,51
208,RADAR Sensor Strength,Radar strength.,2031,0.0,1,RADAR Sensor Strength,120,0,1,6
209,Ladar Sensor Strength,Ladar strength.,2030,0.0,1,Ladar Sensor Strength,120,0,1,6
210,Magnetometric Sensor Strength,Magnetometric strength.,2029,0.0,1,Magnetometric Sensor Strength,120,0,1,6
211,Gravimetric Sensor Strength,Gravimetric strength.,2028,0.0,1,Gravimetric Sensor Strength,120,0,1,6
212,Missile Damage Bonus,"The characters missile use efficiency, scales the damage missiles do.",None,1.0,1,Missile Damage Bonus,104,0,1,30
213,Missile Damage Bonus,Additional percentage to the characters missile damage multiplier.,1397,0.0,1,Missile Damage Bonus,109,1,1,30
216,Capacitor Need Multiplier,Scales the capacitor need for fitted modules.,1400,0.0,1,Capacitor Need Multiplier,105,1,1,5
217,None,The graphicID of the propulsion system.,None,0.0,0,None,None,1,1,31
218,None,Scales the time it takes a character to research a blueprint.,1392,1.0,0,None,None,1,1,9
219,None,Scales the time it takes to manufacture something.,None,1.0,0,None,None,1,1,9
220,None,Bonus or penalty to the percentage time it takes to research a blueprint.,1392,0.0,0,None,None,1,1,9
221,None,Scales the time it takes a character to manufacture a blueprint.,1392,1.0,0,None,None,1,1,9
222,None,Bonus or penalty to the percentage time it takes to manufacture from a blueprint.,1392,0.0,0,None,None,1,1,9
223,None,Scales the time it takes to train skills with Charisma as the primary attribute.,None,1.0,0,None,None,1,1,9
224,None,Scales the time it takes to train skills with Intelligence as the primary attribute. ,None,1.0,0,None,None,1,1,9
225,None,Scales the time it takes to train skills with Memory as the primary attribute.,None,1.0,0,None,None,1,1,9
226,None,Scales the time it takes to train skills with Perception as the primary attribute.,None,1.0,0,None,None,1,1,9
227,None,Scales the time it takes to train skills with Willpower as the primary attribute.,None,1.0,0,None,None,1,1,9
228,None,Bonus or penalty to the percentage time it takes to train skills with Charisma as the primary attribute.,None,0.0,0,None,None,1,1,9
229,None,Bonus or penalty to the percentage time it takes to train skills with Intelligence as the primary attribute.,None,0.0,0,None,None,1,1,9
230,None,Bonus or penalty to the percentage time it takes to train skills with Memory as the primary attribute.,None,0.0,0,None,None,1,1,9
231,None,Bonus or penalty to the percentage time it takes to train skills with Perception as the primary attribute.,None,0.0,0,None,None,1,1,9
232,None,Bonus or penalty to the percentage time it takes to train skills with Willpower as the primary attribute.,None,0.0,0,None,None,1,1,9
235,Maximum Locked Targets Bonus,Additional amount of locked targets that can be handled.,0,0.0,1,Maximum Locked Targets Bonus,139,1,1,37
236,None,Additional amount of attack targets that can be handled.,None,0.0,0,None,139,1,1,9
237,Targeting Range Bonus,Scales the max target range of a ships electronics.,1391,1.0,1,Targeting Range Bonus,109,1,1,24
238,Gravimetric ECM Jammer Strength,+/- modifier to the gravimetric strength of an electronic system.,3226,0.0,1,Gravimetric ECM Jammer Strength,None,0,1,25
239,Ladar ECM Jammer Strength,+/- modifier to the ladar strength of an electronic system.,3228,0.0,1,Ladar ECM Jammer Strength,None,0,1,25
240,Magnetometric ECM Jammer Strength,+/- modifier to the magnetometric strength of an electronic system.,3227,0.0,1,Magnetometric ECM Jammer Strength,None,0,1,25
241,RADAR ECM Jammer Strength,+/- modifier to the radar strength of an electronic system.,3229,0.0,1,RADAR ECM Jammer Strength,None,0,1,25
242,None,Scales the time it takes to lock a target.,104,1.0,0,None,111,1,1,7
243,Maximum Range Multiplier,Scales the range at which something can reach.,1391,1.0,1,Maximum Range Multiplier,104,1,1,26
244,Tracking Speed Multiplier,Scale the tracking speed of a weapon.,1398,1.0,1,Tracking Speed Multiplier,104,1,1,26
245,None,Graphic ID of the turrets for drone type ships.,None,0.0,0,None,None,1,1,31
246,None,Graphic ID of the boosters for drone type ships.,None,0.0,0,None,None,1,1,31
247,None,The distance from a target an entity starts using its weapons.,1391,15000.0,0,None,None,1,1,6
248,None,"The minimum value of any given unit of loot dropped by this entity.  Not the minimum value of all the loot, but of any given item dropped.",None,0.0,0,None,None,1,1,19
249,None,"The maximum value of any loot dropped by this entity.  Thats for each unit of any given item of loot, not for the total value of all items of loot dropped.",None,0.0,0,None,None,1,1,19
250,None,Deprecated. The minimum number of pieces of loot dropped by this entity.,None,0.0,0,None,None,1,1,19
251,None,The maximum number of pieces of loot dropped by this entity.,None,0.0,0,None,None,1,1,19
252,Security Status Kill Amount,"How much security status is modified by for killing this entity.  Depending on the entity, this may be a positive or negative amount.
Value is a % movement of the character's current security towards the upper/lower limit.",None,0.0,1,Security Status Kill Amount,109,1,1,32
253,None,The amount of security status lost of aggressing agaisnt this entity first.,None,0.0,0,None,None,1,1,32
254,None,Minimum loot count that an entity can take from the NPC corp loot resource,None,1.0,0,None,None,1,1,9
256,None,Maximum loot count that an entity can take from the NPC corp loot resource,None,0.0,0,None,None,1,1,9
257,None,The range in m that the entity follows it's target.,None,0.0,0,None,None,1,1,17
258,None,Minimum value of each resource the entity is able to take as loot.,None,0.0,0,None,None,1,1,9
259,None,Maximum value of each resource the entity is able to take as loot.,None,0.0,0,None,None,1,1,9
260,None,The range in m when the entity starts attacking it's target.,1391,0.0,0,None,None,1,1,9
261,None,How much the security status changes when this entity is killed.,None,0.0,0,None,None,1,1,9
262,None,How much the security status changes when this entity is attacked.,None,0.0,0,None,None,1,1,9
263,Shield Capacity,Amount of maximum shield HP on the item.,1384,0.0,1,Shield Capacity,113,1,1,2
264,None,"DO NOT MESS WITH. Helper attribute for entities, stands in for the shield charge.
The amount of starting shield capacity of the NPC.",0,0.0,0,None,None,1,1,9
265,Armor Hitpoints,The number of hit points on the entities armor.,1383,0.0,1,Armor Hitpoints,113,1,1,3
266,Armor Damage,DO NOT MESS WITH. The amount of damage done to the entities armor hit points. Starting armor damage.,0,0.0,1,Armor Damage,None,1,1,9
267,Armor EM Damage Resistance,Multiplies EM damage taken by Armor. ,1396,1.0,1,Armor EM Damage Resistance,108,0,0,3
268,Armor Explosive Damage Resistance,Multiplies EXPLOSIVE damage taken by Armor. ,1395,1.0,1,Armor Explosive Damage Resistance,108,0,0,3
269,Armor Kinetic Damage Resistance,Multiplies KINETIC damage taken by Armor. ,1393,1.0,1,Armor Kinetic Damage Resistance,108,0,0,3
270,Armor Thermal Damage Resistance,Multiplies THERMAL damage taken by Armor. ,1394,1.0,1,Armor Thermal Damage Resistance,108,0,0,3
271,Shield EM Damage Resistance,Multiplies EM damage taken by shield,1396,1.0,1,Shield EM Damage Resistance,108,0,0,2
272,Shield Explosive Damage Resistance,Multiplies EXPLOSIVE damage taken by Armor. ,1395,1.0,1,Shield Explosive Damage Resistance,108,0,0,2
273,Shield Kinetic Damage Resistance,Multiplies KINETIC damage taken by Armor. ,1393,1.0,1,Shield Kinetic Damage Resistance,108,0,0,2
274,Shield Thermal Damage Resistance,Multiplies THERMAL damage taken by Shield. ,1394,1.0,1,Shield Thermal Damage Resistance,108,0,0,2
275,Training time multiplier,This attribute is a multiplier to the number of skill points required to train. Skill points required to train a skill = 250 * skillTimeConstant * sqrt(32)^(skillLevel - 1),1392,0.0,1,Training time multiplier,104,1,1,7
276,Skill Points,Total accumulated points for skill,33,0.0,1,Skill Points,None,1,1,7
277,None,Required skill level for skill 1,None,0.0,0,None,None,1,1,8
278,None,Required skill level for skill 2,None,0.0,0,None,None,1,1,8
279,None,Required skill level for skill 3,None,0.0,0,None,None,1,1,8
280,Level,Level of skill,33,0.0,1,Level,None,1,1,7
281,Maximum Flight Time,The amount of milliseconds before the object explodes.,1392,0.0,1,Maximum Flight Time,101,0,1,7
282,None,Multiplier to the amount of charge storage space in a launcher.,0,1.0,0,None,104,1,1,9
283,Drone Capacity,This defines the total capacity of drones allowed in the drone bay of the ship,1084,0.0,1,Drone Capacity,9,1,1,10
284,None,Indicates whether the modules ranged effects exlude  members of the users gang.,0,0.0,0,None,None,1,1,9
285,None,Indicates whether the modules ranged effects exlude  members of the users corporation.,0,0.0,0,None,None,1,1,9
286,None,Indicates whether the modules ranged effects exclude ships hostile to the user.,0,0.0,0,None,None,1,1,9
287,None,"Autogenerated skill attribute, kDmgBonus",0,0.0,0,None,None,1,1,9
288,None,"Autogenerated skill attribute, shipCPUBonus",0,0.0,0,None,None,1,1,9
289,None,"Autogenerated skill attribute, turretDamageBonus",0,0.0,0,None,None,1,1,9
290,None,"Autogenerated skill attribute, skillTurretDmgBonus",0,0.0,0,None,None,1,1,9
291,CPU Skill Bonus,"Autogenerated skill attribute, CpuskillBonus",0,0.0,1,CPU Skill Bonus,None,1,1,7
292,Damage Multiplier Bonus,"Autogenerated skill attribute, damageMultiplierBonus",1432,0.0,1,Damage Multiplier Bonus,105,1,1,7
293,Rate Of Fire Bonus,"Autogenerated skill attribute, rofBonus",1397,0.0,1,Rate Of Fire Bonus,105,1,1,7
294,Optimal Range Modifier,"Autogenerated skill attribute, rangeSkillBonus",1391,0.0,1,Optimal Range Modifier,121,1,1,7
295,None,"Autogenerated skill attribute, abPowerBonus",1400,0.0,0,None,None,1,1,9
296,None,"Autogenerated skill attribute, acPowerBonus",1400,0.0,0,None,None,1,1,9
